{
  "schemaVersion": 1,
  "id": "know-your-dance",
  "name": "Know Your Dance",
  "description": "A photo keepsake experience that matches visitors with one of four Indian masked dance traditions.",
  "flow": ["idle", "story", "quiz", "camera", "reveal", "transform", "results", "print", "qr"],
  "idleTimeoutSeconds": 90,
  "parts": {
    "story": "story.json",
    "quiz": "quiz.json",
    "characters": "characters.json",
    "prompts": "prompts.json",
    "print": "print.json",
    "theme": "theme.json"
  },
  "qr": {
    "enabled": true,
    "deliveryBaseUrl": "",
    "autoResetSeconds": 20
  }
}
